{
  "$schema": "https://json-schema.org/draft/2020-12/schema",
  "$id": "https://paycor.local/schemas/rubric.schema.json",
  "type": "object",
  "required": [
    "rubric_id",
    "name",
    "version",
    "effective_from",
    "status",
    "levels"
  ],
  "properties": {
    "rubric_id": { "type": "string", "minLength": 1 },
    "name": { "type": "string", "minLength": 1 },
    "version": { "type": "string", "pattern": "^[0-9]+\\.[0-9]+\\.[0-9]+$" },
    "effective_from": { "type": "string", "format": "date" },
    "effective_to": { "type": ["string", "null"], "format": "date" },
    "status": { "type": "string", "enum": ["draft", "active", "retired", "superseded"] },
    "supersedes": { "type": "string" },
    "levels": {
      "type": "array",
      "minItems": 1,
      "items": {
        "type": "object",
        "required": ["level_id", "name", "sequence", "criteria"],
        "properties": {
          "level_id": { "type": "string", "minLength": 1 },
          "name": { "type": "string", "minLength": 1 },
          "sequence": { "type": "integer", "minimum": 1 },
          "criteria": {
            "type": "array",
            "minItems": 1,
            "items": {
              "type": "object",
              "required": [
                "criterion_id",
                "description",
                "required",
                "evidence_type",
                "gate_weight"
              ],
              "properties": {
                "criterion_id": { "type": "string", "minLength": 1 },
                "description": { "type": "string", "minLength": 1 },
                "required": { "type": "boolean" },
                "evidence_type": {
                  "type": "string",
                  "enum": ["document_link", "review_note", "checklist"]
                },
                "gate_weight": { "type": "integer", "minimum": 0 }
              },
              "additionalProperties": false
            }
          }
        },
        "additionalProperties": false
      }
    }
  },
  "additionalProperties": false
}

